{
  "$schema": "https://json-schema.org/draft/2020-12/schema",
  "$id": "https://example.com/project-portfolio-sheets/single-project-seed.schema.json",
  "title": "Single Project Seed",
  "type": "object",
  "required": ["schemaVersion", "generatedAt", "source", "project", "workItems", "raid", "stakeholders", "changesDecisions"],
  "properties": {
    "schemaVersion": { "const": 1 }, "generatedAt": { "type": "string", "format": "date" }, "source": { "type": "string", "minLength": 1 },
    "project": { "type": "object", "required": ["id", "name", "purpose", "sponsor", "manager", "status"], "properties": { "id": { "type": "string", "minLength": 1 }, "name": { "type": "string", "minLength": 1 }, "purpose": { "type": "string" }, "successMeasures": { "type": "string" }, "sponsor": { "type": "string" }, "manager": { "type": "string" }, "status": { "type": "string" }, "deliveryApproach": { "type": "string" }, "phase": { "type": "string" }, "scope": { "type": "string" }, "outOfScope": { "type": "string" }, "acceptance": { "type": "string" }, "startDate": { "type": "string", "format": "date" }, "targetDate": { "type": "string", "format": "date" }, "budgetBaseline": { "type": "number", "minimum": 0 }, "budgetForecast": { "type": "number", "minimum": 0 }, "budgetActual": { "type": "number", "minimum": 0 }, "governance": { "type": "string" }, "constraints": { "type": "string" }, "sustainability": { "type": "string" }, "lastReview": { "type": "string", "format": "date" }, "nextReview": { "type": "string", "format": "date" }, "tailoring": { "type": "string" } }, "additionalProperties": false },
    "workItems": { "type": "array", "items": { "type": "object", "required": ["id", "type", "title", "status", "priority", "owner"], "properties": { "id": { "type": "string", "minLength": 1 }, "parentId": { "type": "string" }, "level": { "type": "integer", "minimum": 1, "maximum": 10 }, "type": { "type": "string" }, "title": { "type": "string" }, "status": { "type": "string" }, "priority": { "type": "string" }, "owner": { "type": "string" }, "start": { "type": "string", "format": "date" }, "due": { "type": "string", "format": "date" }, "baselineStart": { "type": "string", "format": "date" }, "baselineEnd": { "type": "string", "format": "date" }, "actualStart": { "type": "string", "format": "date" }, "actualEnd": { "type": "string", "format": "date" }, "predecessors": { "type": "string" }, "progress": { "type": "number", "minimum": 0, "maximum": 1 }, "estimate": { "type": "number", "minimum": 0 }, "actual": { "type": "number", "minimum": 0 }, "milestone": { "type": "string" }, "acceptance": { "type": "string" }, "delayReason": { "type": "string" }, "tags": { "type": "string" }, "url": { "type": "string", "format": "uri" }, "memo": { "type": "string" } }, "additionalProperties": false } },
    "raid": { "type": "array", "items": { "type": "object", "required": ["id", "type", "name", "status", "probability", "impact", "owner"], "properties": { "id": { "type": "string" }, "type": { "type": "string" }, "name": { "type": "string" }, "status": { "type": "string" }, "probability": { "type": "string" }, "impact": { "type": "string" }, "exposure": { "type": "string" }, "owner": { "type": "string" }, "registered": { "type": "string" }, "due": { "type": "string" }, "trigger": { "type": "string" }, "response": { "type": "string" }, "nextAction": { "type": "string" }, "url": { "type": "string" }, "memo": { "type": "string" } }, "additionalProperties": false } },
    "stakeholders": { "type": "array", "items": { "type": "object", "required": ["id", "name", "role", "influence", "interest"], "properties": { "id": { "type": "string" }, "name": { "type": "string" }, "role": { "type": "string" }, "influence": { "type": "string" }, "interest": { "type": "string" }, "current": { "type": "string" }, "target": { "type": "string" }, "communication": { "type": "string" }, "cadence": { "type": "string" }, "owner": { "type": "string" }, "last": { "type": "string" }, "next": { "type": "string" }, "memo": { "type": "string" } }, "additionalProperties": false } },
    "changesDecisions": { "type": "array", "items": { "type": "object", "required": ["id", "type", "topic", "content", "status"], "properties": { "id": { "type": "string" }, "type": { "type": "string" }, "registered": { "type": "string" }, "topic": { "type": "string" }, "content": { "type": "string" }, "reason": { "type": "string" }, "impact": { "type": "string" }, "status": { "type": "string" }, "owner": { "type": "string" }, "target": { "type": "string" }, "decisionDate": { "type": "string" }, "relatedIds": { "type": "string" }, "url": { "type": "string" }, "memo": { "type": "string" } }, "additionalProperties": false } }
  }, "additionalProperties": false
}
