{
  "schemaVersion": 1,
  "generatedAt": "2026-08-02",
  "source": "anonymous single-project example",
  "project": {
    "id": "PRJ-001", "name": "地域イベント申込サイト", "purpose": "利用者が迷わず申し込める受付体験を提供する", "successMeasures": "申込完了率90%以上、重大障害0件、予定日までに受入完了", "sponsor": "事業責任者", "manager": "プロジェクト責任者", "status": "注意", "deliveryApproach": "ハイブリッド", "phase": "実行", "scope": "申込フォーム、確認メール、運営者向け一覧", "outOfScope": "決済、会員管理、イベント当日の受付端末", "acceptance": "主要ブラウザで申込から確認メールまで完了し、受入テストに合格する", "startDate": "2026-07-15", "targetDate": "2026-09-30", "budgetBaseline": 500000, "budgetForecast": 520000, "budgetActual": 180000, "governance": "週次定例で確認し、予算・納期・スコープ変更はスポンサー承認", "constraints": "小規模チーム、公開日固定、個人情報を扱う", "sustainability": "アクセシビリティを確保し、運用負荷と不要なデータ保持を抑える", "lastReview": "2026-07-31", "nextReview": "2026-08-07", "tailoring": "2週間単位で優先順位を見直し、必要な記録だけを維持する"
  },
  "workItems": [
    { "id": "DEL-001", "level": 1, "type": "成果物", "title": "申込機能", "status": "進行中", "priority": "高", "owner": "担当A", "baselineStart": "2026-07-15", "baselineEnd": "2026-08-28", "progress": 0.3, "acceptance": "申込から確認メールまでの一連の機能が受入基準を満たす", "tags": "scope,delivery" },
    { "id": "WI-001", "parentId": "DEL-001", "level": 2, "type": "タスク", "title": "申込フローの受入条件を確認", "status": "進行中", "priority": "高", "owner": "担当A", "baselineStart": "2026-07-20", "baselineEnd": "2026-08-08", "progress": 0.6, "estimate": 40, "actual": 24, "acceptance": "スポンサーが受入条件に合意", "tags": "scope,quality" },
    { "id": "MS-001", "parentId": "DEL-001", "level": 2, "type": "マイルストーン", "title": "申込フォーム受入テスト", "status": "未着手", "priority": "最優先", "owner": "担当B", "baselineStart": "2026-08-28", "baselineEnd": "2026-08-28", "predecessors": "WI-001", "progress": 0, "milestone": "受入テスト", "acceptance": "全必須ケースが合格", "tags": "schedule,quality" }
  ],
  "raid": [
    { "id": "R-001", "type": "リスク", "name": "確認メール配信の遅延", "status": "進行中", "probability": "中", "impact": "高", "exposure": "高", "owner": "担当B", "registered": "2026-07-25", "due": "2026-08-14", "trigger": "配信テストが5分を超える", "response": "配信サービスの負荷試験と代替手段を準備", "nextAction": "負荷試験日を設定" }
  ],
  "stakeholders": [
    { "id": "SH-001", "name": "事業責任者", "role": "スポンサー", "influence": "高", "interest": "高", "current": "支持", "target": "主導", "communication": "週次定例で価値・予算・リスクを確認", "cadence": "週次", "owner": "プロジェクト責任者", "last": "2026-07-31", "next": "2026-08-07" }
  ],
  "changesDecisions": [
    { "id": "D-001", "type": "意思決定", "registered": "2026-07-22", "topic": "確認メールの送信方式", "content": "外部配信サービスを採用", "reason": "到達率と運用負荷を考慮", "impact": "月額費用が発生", "status": "承認", "owner": "事業責任者", "decisionDate": "2026-07-23", "relatedIds": "R-001" }
  ]
}
